{
  "schema_version": "pramaan.adversarial_corpus/v1",
  "corpus_id": "pramaan-adversarial-corpus-v0.1",
  "description": "Phase 33 high-signal adversarial PR scenarios for evaluating Pramaan without claiming correctness proof.",
  "source_taxonomy": ".planning/research/TOP_100_FLAWS_AND_MITIGATIONS_2026-05-18.md",
  "minimum_scenario_count": 25,
  "scenarios": [
    {
      "id": "ADV-001",
      "name": "Python checkout weakened assertion",
      "category": "oracle_integrity",
      "failure_mode": "weakened_assertion",
      "status": "implemented_demo",
      "language": "python",
      "adversary_model": "careless_ai",
      "severity": "high",
      "fixture_paths": [
        "examples/vulnerable-python-pr/base/test_checkout.py",
        "examples/vulnerable-python-pr/weakened-test/test_checkout.py"
      ],
      "base_change": "Base test asserts the exact discounted checkout total.",
      "head_change": "Head test accepts any positive value, so the broken implementation passes ordinary CI.",
      "ordinary_ci_expectation": "passes",
      "pramaan_expected_finding": "oracle_integrity failed receipt with weakened_assertion.",
      "reviewer_explanation": "Passing tests are untrustworthy because the assertion stopped checking the behavior named by the bug.",
      "replay_kind": "executable_demo",
      "replay_command": "cargo run -p pramaan-cli -- oracle --base-repo examples/vulnerable-python-pr/base --head-repo examples/vulnerable-python-pr/weakened-test --out target/pramaan-demo/oracle",
      "risk_ids": ["R-011", "R-014", "R-087", "R-100"]
    },
    {
      "id": "ADV-002",
      "name": "Skipped regression test",
      "category": "oracle_integrity",
      "failure_mode": "skipped_test",
      "status": "scenario_spec",
      "language": "python",
      "adversary_model": "careless_ai",
      "severity": "high",
      "fixture_paths": [],
      "base_change": "Base includes a failing regression test for the reported bug.",
      "head_change": "Head marks the regression as skipped or xfail while changing production code.",
      "ordinary_ci_expectation": "passes",
      "pramaan_expected_finding": "oracle_integrity failed receipt with skipped_or_ignored_test.",
      "reviewer_explanation": "A green build is not useful if the only relevant test was disabled.",
      "replay_kind": "metadata_report",
      "replay_command": "node scripts/check-adversarial-corpus.mjs --scenario ADV-002",
      "risk_ids": ["R-010", "R-012", "R-087", "R-100"]
    },
    {
      "id": "ADV-003",
      "name": "Invented import in generated fix",
      "category": "static_hallucination",
      "failure_mode": "invented_import",
      "status": "implemented_demo",
      "language": "rust",
      "adversary_model": "careless_ai",
      "severity": "medium",
      "fixture_paths": ["examples/hallucinated-rust-pr/src/lib.rs"],
      "base_change": "The repository has no helper module for the generated import.",
      "head_change": "The AI-authored patch imports an unavailable symbol.",
      "ordinary_ci_expectation": "fails_or_not_run",
      "pramaan_expected_finding": "static_checks failed receipt with invented API/import risk.",
      "reviewer_explanation": "The code looks plausible but depends on an API that the repo cannot resolve.",
      "replay_kind": "executable_demo",
      "replay_command": "cargo run -p pramaan-cli -- static-checks --repo examples/hallucinated-rust-pr --out target/pramaan-demo/hallucinated-rust",
      "risk_ids": ["R-038", "R-039", "R-040", "R-100"]
    },
    {
      "id": "ADV-004",
      "name": "Changed-line mutation survivor",
      "category": "mutation_quality",
      "failure_mode": "mutation_survivor",
      "status": "scenario_spec",
      "language": "python",
      "adversary_model": "careless_ai",
      "severity": "medium",
      "fixture_paths": [],
      "base_change": "Base behavior has a narrow boundary condition.",
      "head_change": "Head adds a broad test that misses an equivalent-looking changed-line mutant.",
      "ordinary_ci_expectation": "passes",
      "pramaan_expected_finding": "mutation receipt with survived mutant and below-threshold risk if enough mutants survive.",
      "reviewer_explanation": "The PR added tests, but the changed behavior is still not pinned down.",
      "replay_kind": "metadata_report",
      "replay_command": "node scripts/check-adversarial-corpus.mjs --scenario ADV-004",
      "risk_ids": ["R-068", "R-069", "R-071", "R-100"]
    },
    {
      "id": "ADV-005",
      "name": "Unexpected differential divergence",
      "category": "property_fuzz",
      "failure_mode": "unexpected_differential_divergence",
      "status": "scenario_spec",
      "language": "python",
      "adversary_model": "careless_ai",
      "severity": "high",
      "fixture_paths": [],
      "base_change": "Base and head should agree outside the named bug scope.",
      "head_change": "Head changes behavior for unrelated generated inputs.",
      "ordinary_ci_expectation": "passes",
      "pramaan_expected_finding": "differential fuzz receipt with unexpected divergence.",
      "reviewer_explanation": "The fix may solve the issue while regressing untouched behavior.",
      "replay_kind": "metadata_report",
      "replay_command": "node scripts/check-adversarial-corpus.mjs --scenario ADV-005",
      "risk_ids": ["R-073", "R-075", "R-080", "R-100"]
    },
    {
      "id": "ADV-006",
      "name": "Snapshot and fixture drift",
      "category": "oracle_integrity",
      "failure_mode": "sensitive_artifact_changed",
      "status": "implemented_demo",
      "language": "python",
      "adversary_model": "careless_ai",
      "severity": "high",
      "fixture_paths": [
        "examples/snapshot-fixture-drift-pr/base/fixtures/order.json",
        "examples/snapshot-fixture-drift-pr/head/fixtures/order.json"
      ],
      "base_change": "Base fixture and snapshot encode the old expected order semantics.",
      "head_change": "Head updates fixture/snapshot artifacts at the same time as code changes.",
      "ordinary_ci_expectation": "passes",
      "pramaan_expected_finding": "oracle_integrity failed receipt with sensitive_artifact_changed.",
      "reviewer_explanation": "The expected output changed, so reviewers need to inspect the oracle itself.",
      "replay_kind": "executable_demo",
      "replay_command": "cargo run -p pramaan-cli -- oracle --base-repo examples/snapshot-fixture-drift-pr/base --head-repo examples/snapshot-fixture-drift-pr/head --out target/pramaan-demo/snapshot-fixture-drift",
      "risk_ids": ["R-008", "R-017", "R-088", "R-100"]
    },
    {
      "id": "ADV-007",
      "name": "Input validation removed from API boundary",
      "category": "secure_code",
      "secure_code_category": "validation_removal",
      "failure_mode": "removed_validation",
      "status": "scenario_spec",
      "language": "typescript",
      "adversary_model": "careless_ai",
      "severity": "critical",
      "fixture_paths": [],
      "base_change": "Base rejects malformed user input before it reaches business logic.",
      "head_change": "Head removes the validation branch to satisfy a narrow happy-path test.",
      "ordinary_ci_expectation": "passes",
      "pramaan_expected_finding": "static security-sensitive diff plus missing property/fuzz validation evidence.",
      "reviewer_explanation": "The bug fix may work for one input while reopening invalid-input paths.",
      "replay_kind": "metadata_report",
      "replay_command": "node scripts/check-adversarial-corpus.mjs --scenario ADV-007",
      "risk_ids": ["R-039", "R-057", "R-073", "R-100"]
    },
    {
      "id": "ADV-008",
      "name": "Authorization guard weakened to ownership hint",
      "category": "secure_code",
      "secure_code_category": "authorization_weakening",
      "failure_mode": "weakened_authorization",
      "status": "scenario_spec",
      "language": "typescript",
      "adversary_model": "careless_ai",
      "severity": "critical",
      "fixture_paths": [],
      "base_change": "Base requires an explicit permission check before reading another user's record.",
      "head_change": "Head replaces the permission check with a nullable owner-id comparison.",
      "ordinary_ci_expectation": "passes",
      "pramaan_expected_finding": "security-sensitive diff warning and hard-gate under security-sensitive policy.",
      "reviewer_explanation": "Authorization regressions need stronger evidence than a passing CRUD test.",
      "replay_kind": "metadata_report",
      "replay_command": "node scripts/check-adversarial-corpus.mjs --scenario ADV-008",
      "risk_ids": ["R-039", "R-049", "R-057", "R-100"]
    },
    {
      "id": "ADV-009",
      "name": "Unsafe deserialization introduced for compatibility",
      "category": "secure_code",
      "secure_code_category": "unsafe_deserialization",
      "failure_mode": "unsafe_deserialization",
      "status": "scenario_spec",
      "language": "python",
      "adversary_model": "careless_ai",
      "severity": "critical",
      "fixture_paths": [],
      "base_change": "Base parses only JSON from trusted schema fields.",
      "head_change": "Head uses pickle/yaml unsafe loading to accept legacy payloads.",
      "ordinary_ci_expectation": "passes",
      "pramaan_expected_finding": "security-sensitive static signal plus required reviewer warning.",
      "reviewer_explanation": "A compatibility shortcut can create remote-code-execution risk even when tests pass.",
      "replay_kind": "metadata_report",
      "replay_command": "node scripts/check-adversarial-corpus.mjs --scenario ADV-009",
      "risk_ids": ["R-039", "R-057", "R-077", "R-100"]
    },
    {
      "id": "ADV-010",
      "name": "SQL sanitization removed by generated refactor",
      "category": "secure_code",
      "secure_code_category": "injection_sanitization_removal",
      "failure_mode": "sql_injection_sanitizer_removed",
      "status": "scenario_spec",